Raw Review,Cleaned Review
"Not nearly as bad as I expected from everything I've heard. Not great, but not terrible. I can see why there has been such widespread disdain of the movie, because the overall quality of it is mid (as the kids say today), and it may be even more insulting to the hardcore comic fans, but it had the basic pieces of an entertaining movie.I think what I liked most was how it grounded a mythological story, including a main character who learns she can see the future, while still being able to insert some heart into the center. And except maybe for the opening scene, the writing and acting were fairly decent. I even thought the pacing and direction of the story made sense.Yes, there were dozens of head-scratching moments about why certain characters made certain choices, particularly the villain, but not enough to tank the experience for me. I think this is the director's first major motion picture; I looked up S. J. Clarkson and she mostly has directed TV shows. I'm good with Sony Pictures giving people a chance, but I do sometimes wonder why they do it with origin story movies of beloved comic book characters. Seems risky.This was my first Dakota Johnson movie. I've heard her name a bunch but I hadn't seen anything with her in it prior to this role of Cassandra Webb. She was great the whole way through. Not until I looked her up after the movie did I know she was the daughter of Melanie Griffith and Don Johnson. The fact that I remember when those two got together, and that Dakota is currently 34 years old, means I'm old.The rest of the cast was fine. Again, I honestly don't think this movie was bad. If I had to rate it, then maybe a 5 out of 10? Perfectly average, and there's nothing wrong with that.And a bonus: Dakota Johnson looks great in jeans.",nearli bad expect everyth ive heard great terribl see widespread disdain movi overal qualiti mid kid say today may even insult hardcor comic fan basic piec entertain moviei think like ground mytholog stori includ main charact learn see futur still abl insert heart center except mayb open scene write act fairli decent even thought pace direct stori made sensey dozen headscratch moment certain charact made certain choic particularli villain enough tank experi think director first major motion pictur look j clarkson mostli direct tv show im good soni pictur give peopl chanc sometim wonder origin stori movi belov comic book charact seem riskythi first dakota johnson movi ive heard name bunch hadnt seen anyth prior role cassandra webb great whole way look movi know daughter melani griffith johnson fact rememb two got togeth dakota current year old mean im oldth rest cast fine honestli dont think movi bad rate mayb perfectli averag there noth wrong thatand bonu dakota johnson look great jean
"With Marvel Studios taking on more responsibility involving Spider-Man, Sony have decided to try and build a universe involving smaller characters from the same lore as him. We have had Venom and Morbius and will get Kraven The Hunter later this year but here we have Madame Web. I saw this film last night and here is my review for Madame Web. The p[remise of the film sees a women bestowed with powers where she has to save 3 girls from being killed by a villainous foe.Main Character
I must be honest that I have never been a huge fan of Dakota Johnson and she plays Cassandra Web here and I have to be honest she isn't particularly good here. She is overacting everything here and her character is super unlikeable and hard to care about. She is clearly hampered by the awful writing in this film and she can't rise above it and give us a lead role to support or care about and Cassie Web will go down as one of the worst leads in a comic book film ever.Supporting Characters
Sydney Sweeney, Isabela Merced & Celeste O'Connor play the three girls that are in the view of the villain and they are all pretty awful. Their characters are really awkward and not particularly likeable, the film tries to force you to like and care about these characters but it comes across poorly and these actresses aren't good enough to make me care.Tahar Rahim plays Ezekiel Sims and he is one of the more frustrating parts of this film because I have seen him be a good actor and this character had some potential but the film really flops here and makes him this over the top villain that is so stupid that it really takes you out of the film.Adam Scott as Ben Parker is probably the best person here but he isn't really given much to do and it still upsets me that he plays Ben Parker and it is really clear that this was just done to provide some stupid fan service that actually annoys me even more.Story
The story is nonsensical and completely stupid. The plot makes no sense and characters do things that make no sense, Cassie Web in particular is one of the dumbest characters that I have seen in recent movies. This film also tries its best to ruin the character of Spider-Man even though he isn't in the film and it is just the backdrop to this pretty dull and horrendous adventure.Script
This is a really awfully written film. Things make no sense, characters are unlikeable and there is no humour here at all. There are so many plot holes it is crazy and the film has nothing interesting about it at all.Style
I mean I guess the action scenes are okay and the bad guys suit was okay but that is it. The film is filmed really poorly, the editing looks unfinished and at times it is actually quite jarring to watch it. There are way too many jump scares especially for a film that is not a horror film. The trailer shows things that barely happen in the film and it feels like we were sold a different film that never got made.Overall
Overall, Madame Web is a truly disastrous film. This is up there with one of the worst films I have ever seen and is up there with the worst comic book films of all time. Though I am glad I saw this film to have this experience but at all cost avoid this garbage and do something better for 2 hours.Rating - 1/10.",marvel studio take respons involv spiderman soni decid tri build univers involv smaller charact lore venom morbiu get kraven hunter later year madam web saw film last night review madam web premis film see woman bestow power save girl kill villain foemain charact must honest never huge fan dakota johnson play cassandra web honest isnt particularli good overact everyth charact super unlik hard care clearli hamper aw write film cant rise give u lead role support care cassi web go one worst lead comic book film eversupport charact sydney sweeney isabela merc celest oconnor play three girl view villain pretti aw charact realli awkward particularli likeabl film tri forc like care charact come across poorli actress arent good enough make caretahar rahim play ezekiel sim one frustrat part film seen good actor charact potenti film realli flop make top villain stupid realli take filmadam scott ben parker probabl best person isnt realli given much still upset play ben parker realli clear done provid stupid fan servic actual annoy even morestori stori nonsens complet stupid plot make sen charact thing make sen cassi web particular one dumbest charact seen recent movi film also tri best ruin charact spiderman even though isnt film backdrop pretti dull horrend adventurescript realli aw written film thing make sen charact unlik humour mani plot hole crazi film noth interest allstyl mean guess action scene okay bad guy suit okay film film realli poorli edit look unfinish time actual quit jar watch way mani jump scare especi film horror film trailer show thing bare happen film feel like sold differ film never got madeoveral overal madam web truli disastr film one worst film ever seen worst comic book film time though glad saw film experi cost avoid garbag someth better hoursrat
"Literally I had zero expectations when I went to watch this flick but I still thought that something should be good in this to watch at least one time because of marvel name in it. But this movie is so low and looks like low budget CGI thriller and a comedy in the name of superhero genre.I mean from the start itself movie lost it's pace and story and god only knows what are they showing no interest in the screenplay and the plot is not even engaging to watch for at least 30 mins.I only went for Dakota & Sydney just because the screen presence of them looks good, but the director loss this opportunity too. Because the character they're playing is so bad and not even proper dialogues are given and just they have made a common character with no story arc just the situation that they have to act
I've never seen such a bad cinematography of any film it looks like they don't have any interest making this film so they just made a spoof just to show that we are making a movie. Don't know what to say more because this film is that bad.Overall a Boring fest and a spoof fo a superhero genre.",liter zero expect went watch flick still thought someth good watch least one time marvel name movi low look like low budget cgi thriller comedi name superhero genrei mean start movi lost pace stori god know show interest screenplay plot even engag watch least minsi went dakota sydney screen presenc look good director loss opportun charact theyr play bad even proper dialogu given made common charact stori arc situat act ive never seen bad cinematographi film look like dont interest make film made spoof show make movi dont know say film badoveral bore fest spoof fo superhero genr
"Ok, so before people come at me with the ""YoU dIdN't LiKe It BeCaUsE iT wAs FeMaLe LeAd."" chestnut. I went into this one with an open mind, but expecting it to be as described & the reviews were right. The film is bad.The film sees Cassandra Webb who is a New York metropolis paramedic who begins to demonstrate signs of clairvoyance. Forced to challenge revelations about her past, she needs to safeguard 3 young girls from a deadly adversary who wants them destroyed.I found the film to be pretty bad. It's disjointed, clunky, poorly paced & just feels very awkward & stiff. The characters are personality-less, they look & sound as if they're reciting their lines from cue cards (almost robotic, I might add) & the script reads like a supermarket shopping receipt.The films story is all over the place, confusing & hard to follow. The premonition sequences the main lead experiences were annoying & while creative, were repetitive to the point where you couldn't tell if she was hallucinating or actually seeing what she was seeing.The films runtime is overly long for what it is, while not as bad as other films which are generally over 2 hours (rolls eyes), this film felt longer & as I said was too long for what it was at 1 hour & 48 minutes (108 minutes) without credits & the pacing, jeez... don't get me started.The actors were alright, but what they were given script wise, didn't work & made them come across as flat. There's some action & not bad effects to be had, but that's pretty much the only redeeming features from this flick, sadly. It hasn't a lot going for it & is pretty lack luster & basic.Don't get me wrong, I prefer films with straight forward story-lines & plots you can follow, but this one was a bit too basic & could've used more meatiness to beef it up more as well as more emphasis to keep the audience engaged with the story, characters, action etc.I generally didn't like the film & the ending is just out there too & is pretty cringy like some of the scenes in the film as well as the few cringy action sequences themselves among some of the good action we got.Overall, it's a bad film. And no, it's got nothing to do with the old chestnut of me being a man who doesn't like the film because it's female lead. The film was bad & had plenty of things wrong with it. People in general, men & women, boys & girls, didn't like this flick.The story is bland, boring & paper thin like the characters & leads, the little bit of good action & effects seen are overshadowed by the aforementioned issues as well as the other issues like the poor runtime, pacing & the lacking engagement the film has.Also, for those who can't seem to get it in their heads, there's been plenty of female lead films in the past that have done well, from the Alien Franchise to The Hunger Games along with Elektra, Tomb Raider, Salt, Lucy, Hanna etc. I could go on but that's my rant for those who need calling out.2/10.",ok peopl come didnt like femal lead chestnut went one open mind expect describ review right film badth film see cassandra webb new york metropoli paramed begin demonstr sign clairvoy forc challeng revel past need safeguard young girl deadli adversari want destroyedi found film pretti bad disjoint clunki poorli pace feel awkward stiff charact personalityless look sound theyr recit line cue card almost robot might add script read like supermarket shop receiptth film stori place confus hard follow premonit sequenc main lead experi annoy creativ repetit point couldnt tell hallucin actual see seeingth film runtim overli long bad film gener hour roll eye film felt longer said long hour minut minut without credit pace jeez dont get startedth actor alright given script wise didnt work made come across flat there action bad effect that pretti much redeem featur flick sadli hasnt lot go pretti lack luster basicdont get wrong prefer film straight forward storylin plot follow one bit basic couldv use meati beef well emphasi keep audienc engag stori charact action etci gener didnt like film end pretti cringi like scene film well cringi action sequenc among good action gotoveral bad film got noth old chestnut man doesnt like film femal lead film bad plenti thing wrong peopl gener men woman boy girl didnt like flickth stori bland bore paper thin like charact lead littl bit good action effect seen overshadow aforement issu well issu like poor runtim pace lack engag film hasalso cant seem get head there plenti femal lead film past done well alien franchis hunger game along elektra tomb raider salt luci hanna etc could go that rant need call
"A baby-sitting movie in a Superhero setting, where the lead can see the future and has to prevent NOT-Spiderman from killing teenagers (because he has dreams/visions about them). The girls run and hide around a lot, some BS happens and then the movie ends.The foundation of the script is heavily written around a hollow core of ""parents and children"". The cinematography is actually good, and at least ""teaches"" how to do CPR. It also does away with showing premonitions every time something is to be changed near the end.. respecting the viewers intelligence in at least that aspect! And it's easy to follow (if you don't fall asleep) with how simplistic it is.Aside from that, it is barely anything else..
The movie itself isn't terrible.. it's just beyond bland and boring. Also, calling this a Superhero movie is really disingenuous and a marketing ploy to get people to see it. Stay home! There are no good action sequences and nobody is written memorably....
Venom making money was a mistake. Sony has half a franchise, and they can't get anyone talented enough to do something with it. And what they continue to release seems like high-budgeted fan fiction!",babysit movi superhero set lead see futur prevent notspiderman kill teenag dreamsvis girl run hide around lot b happen movi endsth foundat script heavili written around hollow core parent child cinematographi actual good least teach cpr also away show premonit everi time someth chang near end respect viewer intellig least aspect easi follow dont fall asleep simplist isasid bare anyth el movi isnt terribl beyond bland bore also call superhero movi realli disingenu market ploy get peopl see stay home good action sequenc nobodi written memor venom make money mistak soni half franchis cant get anyon talent enough someth continu releas seem like highbudget fan fiction
"I could tell from the beginning, making this movie was a bad idea. After I saw the cast I could tell this movie doomed. I have nothing against any of those actors but I must say casting a Dakota was a biggest mistake for the role! Anyone read the comics could say that. This movie was like terminator meeting final destination! No good story, big mess, lot of waste of potentials. I must say worst choice of villain! We have good movies, bad movies but like to watch but this was bad bad like that bad I was torturing myself to sit through the whole movie. I wonder do they even watch their movie?!!$",could tell begin make movi bad idea saw cast could tell movi doom noth actor must say cast dakota biggest mistak role anyon read comic could say movi like termin meet final destin good stori big mess lot wast potenti must say worst choic villain good movi bad movi like watch bad bad like bad tortur sit whole movi wonder even watch movi
"Verona Parker is easily one of the worst characters ever written for the screen, takes away everything this movie aspires to be. The actress also did a piss poor job and always had me cringing at the unrealistic and unreasonable choices she makes. If you'd delete that character entirely, this movie would've been a whole lot better in the long run.Subject wise it's a very nice concept of a revenge thriller against scam call centers- but again, the whole govt mumbo jumbo makes it feel a whole run of the mill action BS from Hollywood mid tier movies. If the story had been awhole lot grounded, it would've done a whole lot better imo.",verona parker easili one worst charact ever written screen take away everyth movi aspir actress also piss poor job alway cring unrealist unreason choic make youd delet charact entir movi wouldv whole lot better long runsubject wise nice concept reveng thriller scam call center whole govt mumbo jumbo make feel whole run mill action b hollywood mid tier movi stori awhol lot ground wouldv done whole lot better imo
"By now, audiences should realize what they are in for when it comes to Jason Statham leading an action film. The Beekeeper is the latest film to continue his long-running legacy of action flicks and it's quite a bit of fun. It's very far from an awards nominee, but for a film I had zero expectations for, and for being as cheesy as it is, it's pretty good. Take that as you will because I will be diving into things that are also pretty bad as well. The cheesiness of this film will turn some people off, but I was able to ignore it. Here's why I recommend The Beekeeper if you want to watch a new action-packed film to enjoy and not have to think too much about.The ""Beekeepers"" is an organization of hitmen who take out criminals. Jason Statham plays Adam Clay, a retiree from this organization, who is on a manhunt for everyone involved in scamming a woman he cared for, which led to her suicide. It's as simple as that. There are multiple bosses in this company, so it's like watching a sophisticated video game being played out. The action sequences are well-choreographed and there are quite a few action scenes, so overall, this film was a blast to watch. With that said, the dialogue from beginning to end it pretty atrocious.If the script had been reworked, I think this could've been a surprisingly great film as a whole. Sadly, the dialogue is full of Bee puns that fall flat almost every time, even with solid actors delivering them. The character arc and dialogue for Josh Hutcherson's Derek Danforth (who is the main villain of the film) is laughable, and not really in a good way. His whiny, self-entitled performance was great and I liked that he was giving this character his all, it's just that, again, the dialogue sucks. The lines everyone was saying took me out of the experience many times. Still, there is a lot of great action, and that's what I wanted from a movie like this anyway. I'm sure the dialogue will have people hating this movie and I'm equally sure certain people will find it hilarious. I'm kind of in the middle.The Beekeeper is David Ayer's latest directorial effort and as always, he does a great job with action. His touch as a director is always welcomed by me and the neon look to the film was cool as well. It's a cool film to watch and it's aesthetically pleasing. I may be ripping apart the script, but it's just the dialogue. The story itself plays out nicely and has a nice resolution. I was looking for a fun action film and this film delivered that, despite its downfalls. I say check it out.",audienc realiz come jason statham lead action film beekeep latest film continu longrun legaci action flick quit bit fun far award nomine film zero expect cheesi pretti good take dive thing also pretti bad well cheesi film turn peopl abl ignor here recommend beekeep want watch new actionpack film enjoy think much aboutth beekeep organ hitman take crimin jason statham play adam clay retire organ manhunt everyon involv scam woman care led suicid simpl multipl bos compani like watch sophist video game play action sequenc wellchoreograph quit action scene overal film blast watch said dialogu begin end pretti atrociousif script rework think couldv surprisingli great film whole sadli dialogu full bee pun fall flat almost everi time even solid actor deliv charact arc dialogu josh hutcherson derek danforth main villain film laughabl realli good way whini selfentitl perform great like give charact dialogu suck line everyon say took experi mani time still lot great action that want movi like anyway im sure dialogu peopl hate movi im equal sure certain peopl find hilari im kind middleth beekeep david ayer latest directori effort alway great job action touch director alway welcom neon look film cool well cool film watch aesthet plea may rip apart script dialogu stori play nice nice resolut look fun action film film deliv despit downfal say check
"I seem to use that headline a lot. I guess it's better than a bad movie with bad fight scenes.Starting with the good, Statham is awesome as usual. And I loved all of the fight scenes. They are ridiculously fast yet completely clear. It's hard hitting, you can feel the blows. This is enhanced by the beastly IMAX speakers. And with the R-rating, it doesn't hold back. Although it's far from gratuitous.The bad? Sigh. The non-action scenes, which make up the majority of the movie, range from average to terrible. The quality level feels like a streaming movie, not a theatrical one. I spent much of the runtime uninterested and unengaged.Everything feels off. The dialogue is weird. The acting is questionable. And there are a bunch of dumb things that strain believability. Like the entire bad guy organization. Or a laugh-out-loud idiotic character decision during the climax. A true ""are you kidding me?"" moment.Even the cut to credits felt odd. Like the director just cut in the middle of a shot and said, ""screw it, let's go home.""(1 viewing, early screening UltraScreen 1/6/2024)",seem use headlin lot guess better bad movi bad fight scenesstart good statham awesom usual love fight scene ridicul fast yet complet clear hard hit feel blow enhanc beastli imax speaker rrate doesnt hold back although far gratuitousth bad sigh nonact scene make major movi rang averag terribl qualiti level feel like stream movi theatric one spent much runtim uninterest unengagedeveryth feel dialogu weird act question bunch dumb thing strain believ like entir bad guy organ laughoutloud idiot charact decis climax true kid momenteven cut credit felt odd like director cut middl shot said screw let go home view earli screen ultrascreen
"Just when you think we have reached the bottom of filmmaking ... there is always something like this flick just to prove you can do a lot worse! It s so bland. The FBI agent was not professional and dressed and sounded dumb, lost mom by suicidal act and that did not play much of a roll after the incident,, the villains sounded stupid, especially the dip shots from the call centers. The story idea was great, Jason was awesome but the rest of the actors failed to bring it home. This movie is a terrible revenge story. The idea that Beekeepers are the most elite, well-trained, best equipped one man army is so over-used. The most unbelievable part is that he is hunted by mercenaries, law enforcement, and other Beekeepers. The acting is terrible, the storyline is worse.",think reach bottom filmmak alway someth like flick prove lot wors bland fbi agent profession dress sound dumb lost mom suicid act play much roll incid villain sound stupid especi dip shot call center stori idea great jason awesom rest actor fail bring home movi terribl reveng stori idea beekeep elit welltrain best equip one man armi overus unbeliev part hunt mercenari law enforc beekeep act terribl storylin wors
