Raw Review,Cleaned Review
"Matthew Vaughn is one of my favorite directors. He has three movies that are on my all-time favorites list: Kick-Ass, X-Men: First Class, and Kingsman: The Secret Service. I love his style and consider him a master filmmaker.His last movie, The King's Man, was terrible. I gave it 2 stars. But no one is perfect and it's easy to forgive one misfire. But with Argylle, we have another severely disappointing entry. It's not nearly as bad as The King's Man, but that might be why it's even more disappointing. It could have been great.Why doesn't Argylle work? Movies are so complex, it's difficult to answer that question. Here are my guesses. First, the humor and attempts to be quirky feel off. I only laughed once. Second, there are a few cool action scenes, but nothing to write home about.Third, what idiot decided this should be PG-13? There are so many deaths, but they can't fully show it. So it feels neutered. They do this to sell more tickets, catering to the casuals. But my theater was nearly empty on opening night. So casuals didn't show up and you alienate your true fans. Fourth, for what amounts to a popcorn flick, I was fairly bored and unengaged.But I think one thing hurt the movie more than anything else. This is a great cast except for one role. The most important one. The main character. I don't dislike Bryce Dallas Howard. But this was a horrendous casting choice. I can list out 30 actresses that would have been better suited for the role. It doesn't seem too bad early on, but the further we get into the story, the worse it gets. It's not even a tiny bit believable.I still look forward to future Matthew Vaughn projects. But I just found out that his next movie is a sequel to The King's Man. Why????? I can only hope he reevaluates and tries to get back on track.(1 viewing, opening Thursday UltraScreen 2/1/2024)",matthew vaughn one favorit director three movi alltim favorit list kickass xmen first class kingsman secret servic love style consid master filmmakerhi last movi king man terribl gave star one perfect easi forgiv one misfir argyl anoth sever disappoint entri nearli bad king man might even disappoint could greatwhi doesnt argyl work movi complex difficult answer question guess first humor attempt quirki feel laugh second cool action scene noth write home aboutthird idiot decid pg mani death cant fulli show feel neuter sell ticket cater casual theater nearli empti open night casual didnt show alien true fan fourth amount popcorn flick fairli bore unengagedbut think one thing hurt movi anyth el great cast except one role import one main charact dont dislik bryce dalla howard horrend cast choic list actress would better suit role doesnt seem bad earli get stori wors get even tini bit believablei still look forward futur matthew vaughn project found next movi sequel king man hope reevalu tri get back track view open thursday ultrascreen
"This film would have been a hit if released in the 70s or 80s. Unfortunately, for the current audience, it falls short of expectations, especially for those anticipating a show akin to Kingsman.Positive:
Bryce performs admirably in her humorous role, and Rockwell delivers his part well. It's an enjoyable movie for a one-time watch, especially if you go in with no expectations or have nothing else to do. The best scene is in the beginning.Negative:
John Cena, Henry, and Samuel Jackson seem to be added to the movie solely for marketing purposes. While the movie starts with a good pace, it slows down significantly in the middle and degrades from there. The last 30 minutes feel like the ending of a 70s movie.",film would hit releas unfortun current audienc fall short expect especi anticip show akin kingsmanposit bryce perform admir humor role rockwel deliv part well enjoy movi onetim watch especi go expect noth el best scene beginningneg john cena henri samuel jackson seem ad movi sole market purpos movi start good pace slow significantli middl degrad last minut feel like end movi
"Argylle is a long, dumb, CGI-riddled mess. In other words, it's the standard modern day Hollywood movie. Some aspects are fun but the whole thing drags on and on until you'll be checking your watch every five minutes in hopes that it will be over soon. There is an abundance of CGI and a lot of it is terrible(especially the cat) and it makes the movie look fake but that's the norm these days. I'm not even sure if they filmed any scenes in London because the exterior shots looked really bad to me. Some of the hand to hand combat is pretty decent but for the most part I didn't care about what was happening at all. Additionally, some of the twists in this worked but overall it just kept doing more and more of them and became a convoluted wreck.Furthermore, the trailers and posters for this film straight up lie. They have you believe that Henry Cavill will be the star of the movie but he's in this for all of maybe five minutes at most. Those five minutes prove that he would be a great James Bond but I bet that will never happen because why make the correct choice and cast someone that is perfect for a role. Additionally, John Cena is in this for even less time and it makes me wonder why they even bothered casting him as he must've cost them a fair amount of money for what amounts to a cameo. The rest of the cast is fine and I like Sam Rockwell so it's nice to see him in a leading role. On the other hand, the comedy doesn't land at all and no one in my screening was laughing at any of the jokes. I think think the PG-13 rating hurts the movie by making it too tame and making it Rated R would've helped it a bit.. If this thing was made in the 90s it would've been much prettier, shorter, bloodier and most importantly, more fun. Argylle, however is just nonsensical, looks awful and overstays its welcome.",argyl long dumb cgiriddl mess word standard modern day hollywood movi aspect fun whole thing drag youll check watch everi five minut hope soon abund cgi lot terribleespeci cat make movi look fake that norm day im even sure film scene london exterior shot look realli bad hand hand combat pretti decent part didnt care happen addit twist work overal kept becam convolut wreckfurthermor trailer poster film straight lie believ henri cavil star movi he mayb five minut five minut prove would great jame bond bet never happen make correct choic cast someon perfect role addit john cena even le time make wonder even bother cast mustv cost fair amount money amount cameo rest cast fine like sam rockwel nice see lead role hand comedi doesnt land one screen laugh joke think think pg rate hurt movi make tame make rate r wouldv help bit thing made wouldv much prettier shorter bloodier importantli fun argyl howev nonsens look aw overstay welcom
"Argylle (2024) :
Movie Review :Argylle Review: Spy-action-comedy movies are rare, but that could be an advantage to many. In its first half, Argylle shows why this genre can be so entertaining and refreshing, and then the second half explains how terrible it can turn out to be and why it shouldn't be made often. There are too many twists, which is actually good, but after a while, it goes over the board, over the head, or whatever you want to call it. ""That's the dumbest thing I've ever heard in my life,"" yells Aidan, aka Sam Rockwell, and you are like, ""Yes! Then why the hell do you want us to believe it?"" That's what happens with the entire second half of this movie as it goes from A to G to C to Z to T to again back to B. That's how MESSY it is. Too many twists make too much of a mess here.Argylle is about a spy novelist, Elly Conway (Bryce Dallas Howard), who has just finished her fifth book on a fictional agent, Argylle (Henry Cavill). For the next book, she decides to visit her mother, Ruth Conway (Catherine O'Hara), to brew some new ideas. On the train, she meets a real agent, Aidan (Sam Rockwell), who is on a mission to save her from a gang. Elly constantly imagines Argylle in place of Aidan while he is busy beating the gang and doing everything to save her. Aidan informs Elly that her novels are not fictional but are turning out to be true. She is a hell of a fortune teller, and that's why the bad gang is after her to get the hold of a certain master file before the good gang, aka Aidan, can get to it. But that's not even half of what you are about to see in the second half, so let's not spoil anything because there is a new twist every 10 minutes.The writing of Argylle sounds absurd in the first half, but it's damn funny. That's why you can carry on with it. The idea of merging a fictional agent with a real one and the events was somewhat interesting and was made watchable with a touch of comedy. The problem appears in the second half when you learn the truth about Elly, Aidan, and the gang members, including her parents. Every single theory starts annoying you, and then you get a horrible climax, full of mindless action and senseless ideas. From memory loss to brainwashing to even hypnotism, come on, man, that's just way above the line. That's too much. Argylle leaves you exhausted with the displeasure of watching 3-4 bad spy movies in that last hour. Can you imagine that?Bryce Dallas Howard as Elly Conway looks cute, but she has a deadly side to show too. Her punchlines don't come out as they should, but we can't think of any good female comedy statures after Barbie. The idea and standard have both changed now. Sam Rockwell impresses in some scenes and remains steady throughout the film. The handsome agent, Henry Cavill, is all what girls would make noise about. But the role? Let me change the subject. Bryan Cranston and Catherine O'Hara have a few surprises in store, but the performances aren't that good. Ariana DeBose, Dua Lipa, John Cena, and Samuel Jackson enjoy the screen time with their small supportive roles, while Sofia Boutella finds the best space amongst them. Alfie, aka Chip, the cat, will entertain you with her silence, but don't be surprised by her claws at the end.On the technical front, Argylle seemed okay, with some problems in the sound design. The cinematography was good, and the VFX work on those swipe-to-agents scenes was fantastic. You gotta give some credit to the screenplay writer for visualising those things on paper. It was a new experience, despite its stupidity. We aren't complaining about absurd humour here, and nobody minds that until it is making you laugh. Argylle fails to understand where to stop. You just can't expect us to believe every unreliable thing coming one after another for over a half hour. Matthew Vaughn's vision was too out of the line, too unimaginable, and unconvincing. He could have removed all those bunches of twists in the end and made a simple spy comedy, but he preferred to make it messy, and the results are not what spy movie lovers deserve. As a whole, Vaughan's attempt at over-novelization struggles to find the right ideas, so let's not open the book this time.RATING - 3/10*",argyl movi review argyl review spyactioncomedi movi rare could advantag mani first half argyl show genr entertain refresh second half explain terribl turn shouldnt made often mani twist actual good goe board head whatev want call that dumbest thing ive ever heard life yell aidan aka sam rockwel like ye hell want u believ that happen entir second half movi goe g c z back b that messi mani twist make much mess hereargyl spi novelist elli conway bryce dalla howard finish fifth book fiction agent argyl henri cavil next book decid visit mother ruth conway catherin ohara brew new idea train meet real agent aidan sam rockwel mission save gang elli constantli imagin argyl place aidan busi beat gang everyth save aidan inform elli novel fiction turn true hell fortun teller that bad gang get hold certain master file good gang aka aidan get that even half see second half let spoil anyth new twist everi minutesth write argyl sound absurd first half damn funni that carri idea merg fiction agent real one event somewhat interest made watchabl touch comedi problem appear second half learn truth elli aidan gang member includ parent everi singl theori start annoy get horribl climax full mindless action senseless idea memori loss brainwash even hypnot come man that way line that much argyl leav exhaust displeasur watch bad spi movi last hour imagin thatbryc dalla howard elli conway look cute deadli side show punchlin dont come cant think good femal comedi statur barbi idea standard chang sam rockwel impress scene remain steadi throughout film handsom agent henri cavil girl would make nois role let chang subject bryan cranston catherin ohara surpris store perform arent good ariana debos dua lipa john cena samuel jackson enjoy screen time small support role sofia boutella find best space amongst alfi aka chip cat entertain silenc dont surpris claw endon technic front argyl seem okay problem sound design cinematographi good vfx work swipetoag scene fantast gotta give credit screenplay writer visualis thing paper new experi despit stupid arent complain absurd humour nobodi mind make laugh argyl fail understand stop cant expect u believ everi unreli thing come one anoth half hour matthew vaughn vision line unimagin unconvinc could remov bunch twist end made simpl spi comedi prefer make messi result spi movi lover deserv whole vaughan attempt overnovel struggl find right idea let open book timer
"Matthew Vaughn has always been a director I have admired. Whether you are talking about his earlier works in Layer Cake or Stardust, or his over-the-top action films in Kick-Ass or The Kingsman films, I have never disliked his work until recently. It was not until 2021's The King's Man that I found his work to feel a little stale. That film didn't work for me on many levels, but I have either liked or loved the rest of his filmography otherwise. Well, you can put Argylle down as another one of his that I liked. There has been a lot of criticism, but I do not fully agree with it.This is going to be a difficult one to describe without sounding confusing, but I will give it a go. Elly Conway (Bryce Dallas Howard) is a novelist who has written a book series known as Argylle. What she does not realize is that the events of the book have actually happened in reality and continue to happen in real-time as she writes her next sequel. In comes Aidan Wilde (Sam Rockwell), a spy who shows up to protect Elly and takes her on a crazy adventure, avoiding a real-life spy organization out to get her. While this plot goes on, Elly sees visions of the main character in her book, Argylle (Henry Cavill), who helps her both keep and lose focus on her tasks. What I will say is that this film did not market itself well.Audiences see Henry Cavill, Dua Lipa, and John Cena all over the posters and trailers, but in reality, they collectively have about 10-20 minutes of screen time in a film that is nearly two and a half hours long. Some viewers will be bothered by this so I thought I would mention it, but the fact is, I love both Sam Rockwell and Bryce Dallas Howard and I thoroughly enjoyed their chemistry together here, so I was easily able to forgive that. Where I will complain about the film though, is the fact that it tries to be too clever for its own good. Once something is revealed to the audience as a twist, another twist or two is layered within that twist, and then another few twists are just around the corner. It kept me on the edge of my seat and made it impossible to predict what was coming next (even though I kind of predicted the ending), which was nice, it was just too much all at once.Aside from the ridiculous amount of twists, this film (aside from the opening action sequences) has a fun story and quite a bit of action, especially in the last act. With that said though, as long as you are in for anything (as I was being a Matthew Vaughn fan), the last 30 minutes are just simply wild. Once the main plot twist occurs in the film, it becomes a completely different experience and it shifts gears into silliness, but because I like how Vaughn does silly, I was still in for the ride. I also liked the second Kingsman film, so I know this one won't be for everyone. Simply put, this film is too much, but it was too much of a bunch of things I enjoyed watching, so I can't be overly harsh here. In my opinion, Argylle is a good time and I recommend it, but be aware it gets pretty bonkers.",matthew vaughn alway director admir whether talk earlier work layer cake stardust overthetop action film kickass kingsman film never dislik work recent king man found work feel littl stale film didnt work mani level either like love rest filmographi otherwis well put argyl anoth one like lot critic fulli agre itthi go difficult one describ without sound confus give go elli conway bryce dalla howard novelist written book seri known argyl realiz event book actual happen realiti continu happen realtim write next sequel come aidan wild sam rockwel spi show protect elli take crazi adventur avoid reallif spi organ get plot goe elli see vision main charact book argyl henri cavil help keep lose focu task say film market wellaudi see henri cavil dua lipa john cena poster trailer realiti collect minut screen time film nearli two half hour long viewer bother thought would mention fact love sam rockwel bryce dalla howard thoroughli enjoy chemistri togeth easili abl forgiv complain film though fact tri clever good someth reveal audienc twist anoth twist two layer within twist anoth twist around corner kept edg seat made imposs predict come next even though kind predict end nice much onceasid ridicul amount twist film asid open action sequenc fun stori quit bit action especi last act said though long anyth matthew vaughn fan last minut simpli wild main plot twist occur film becom complet differ experi shift gear silli like vaughn silli still ride also like second kingsman film know one wont everyon simpli put film much much bunch thing enjoy watch cant overli harsh opinion argyl good time recommend awar get pretti bonker
"Matthew Vaughn is a filmmaker who is hit or miss as I enjoyed some of works on Layer Cake, Kick-Ass, and Kingsman: The Secret Service. Argylle has a decent concept and a wonderful cast but unfortunately, this movie is a gigantic mess and might just be his worst movie.Throughout, the production, costumes and camerawork is okay but it feels cheap. The action and stunt moments are pretty solid as there are some decent strong action moments and thrills throughout. Most of the performances were just...fine. Bryce Dallas Howard and Sam Rockwell are doing solid performances but lack chemistry between each other and the rest of the cast members were mostly meh or not good performances. Henry Cavill is just Henry Cavill.Vaughn's direction was messy and the narrative is an interesting concept but it feels predictable and repetitive as it tries to add plot twists and other concepts together which makes it convoluted. Because of that, it made the characters uninteresting and some of the dramatic elements to be a bit boring.With good action and stunts, there are surprisingly some really awful CGI moments throughout. My god that CGI cat is horrendous. The dialogue is pretty rough, the humor and soundtrack is pretty bad, and honestly, this almost feels like something AI would make.I think it's safe to say Matthew Vaughn has kind of lost his touch on what makes his other works really entertaining.",matthew vaughn filmmak hit miss enjoy work layer cake kickass kingsman secret servic argyl decent concept wonder cast unfortun movi gigant mess might worst moviethroughout product costum camerawork okay feel cheap action stunt moment pretti solid decent strong action moment thrill throughout perform justfin bryce dalla howard sam rockwel solid perform lack chemistri rest cast member mostli meh good perform henri cavil henri cavillvaughn direct messi narr interest concept feel predict repetit tri add plot twist concept togeth make convolut made charact uninterest dramat element bit boringwith good action stunt surprisingli realli aw cgi moment throughout god cgi cat horrend dialogu pretti rough humor soundtrack pretti bad honestli almost feel like someth ai would makei think safe say matthew vaughn kind lost touch make work realli entertain
"Firstly ignore the critic's, they really need to chill out sometimes.. Argylle is a fun packed, totally silly movie. Just sit back, don't have preconceptions, and enjoy what is a entertaining film. Sam Rockwell partnership with Bryce Dallas Howard works brilliantly, creating some fabulous funny moments in the film. The whole cast interact their character roles brilliantly with each other creating a comic strip world that revolves around Kingsman narrative. Yes, you could make a case to criticise too much CGI or script isn't hitting the mark, but I want to watch a film and escape the depressing state of the world, I left the cinema having had a great laugh 😃",firstli ignor critic realli need chill sometim argyl fun pack total silli movi sit back dont preconcept enjoy entertain film sam rockwel partnership bryce dalla howard work brilliantli creat fabul funni moment film whole cast interact charact role brilliantli creat comic strip world revolv around kingsman narr ye could make case criticis much cgi script isnt hit mark want watch film escap depress state world left cinema great laugh
"My wife and I watched Argylle (2024) in theaters last night. The storyline revolves around a world-renowned author of spy novels facing a writer's block. She seeks to visit her mother to overcome her mental block, only to discover on her way there her books' are non-fictional and have an impact on reality. What other secrets about her abilities does she remain unaware of?Directed by Matthew Vaughn (Kick-Ass), the film stars Henry Cavill (Man of Steel), Bryce Dallas Howard (The Help), Sam Rockwell (Seven Psychopaths), Bryan Cranston (Breaking Bad), John Cena (Peacemaker), and Samuel L. Jackson (Pulp Fiction).This movie is a complete disaster. It's been a long time since I've seen something this bad. Despite an outstanding cast, every actor is poorly utilized, with only Sam Rockwell's character being hit or miss. Bryce Dallas Howard feels miscast, and the addition of a cat, an awkward skating scene, and a nonsensical dance/smoke sequence contribute to the film's overall failure. The final fight is lackluster, and even the one worthwhile scene featuring Samuel L. Jackson's wine analogy falls flat. Henry Cavill and John Cena add nothing of value, and the film's only redeeming scene, the train sequence, was already shown in previews. The ending hints at an ""Argylle/Kingsman"" Apple+ TV series, but after this disappointment, who needs it?In conclusion, Argylle is a disaster for Apple+ TV, falling far short of the triumphant television series spinoff they hoped for. I would score this a 1/10 and strongly recommend skipping it.",wife watch argyl theater last night storylin revolv around worldrenown author spi novel face writer block seek visit mother overcom mental block discov way book nonfict impact realiti secret abil remain unawar ofdirect matthew vaughn kickass film star henri cavil man steel bryce dalla howard help sam rockwel seven psychopath bryan cranston break bad john cena peacemak samuel l jackson pulp fictionthi movi complet disast long time sinc ive seen someth bad despit outstand cast everi actor poorli util sam rockwel charact hit miss bryce dalla howard feel miscast addit cat awkward skate scene nonsens dancesmok sequenc contribut film overal failur final fight lacklust even one worthwhil scene featur samuel l jackson wine analog fall flat henri cavil john cena add noth valu film redeem scene train sequenc alreadi shown preview end hint argyllekingsman appl tv seri disappoint need itin conclus argyl disast appl tv fall far short triumphant televis seri spinoff hope would score strongli recommend skip
