Raw Review,Cleaned Review
"ArgylleA very hyped movie from the writer of the Kingsman series, the trailer frequently showed moments of silliness, spy action, Bryce Dallas Howard screaming and a cat that's supposedly awesome or something. At first the movie is cheesy as can be, but it does appear that is intentional. Most of the movie leads the audience to believe it is one thing, when it really is another, being revealed in surprise twists that aren't very surprising.The ensemble cast does feature some great performances, even though Henry Cavill's hair is absolutely terrible. Dua Lipa's appearance is short, but she does a great job that it made me miss seeing her. Sam Rockwell continues a trend in Hollywood where age can be defied as I forgot he is in his mid 50s following the likes of Tom Cruise and Jason Statham.The movie is way too long and needed a better editor. I like a fleshed out story as much as the next person, but calm down movie.Now, on to the fun. This movie makes the word ""ridiculous"" woefully inadequate. But it's a fun ridiculous. There are so many laugh out loud moments that it makes up for a lot of the flaws. I don't want to spoil the movie, but keep an eye out for the blink and you'll miss it hilarity.There are themes explored in this film about motivation, and whether the emotions experienced during life's choices, even when told in the format of a spy thriller, would carry over if you got to do it all over again. Personally, I find that theory worth exploring, because I wonder if I'd make the same good or bad decisions if not exposed to certain stimuli or experiences. Nature vs nurture anyone? People admit that they would love to be able to speak to their younger selves to assure them that things would be better eventually, or to avoid pitfalls, but that's not good enough. One never knows if that would make any difference, unless you take away those moments.I enjoyed the heck out of this movie overall, and recommend it for the silliness alone. Don't take the movie seriously, and I believe you will too. The entire, very long, ending sequence is just crazy with the suspension of disbelief, but embrace it.",argyllea hype movi writer kingsman seri trailer frequent show moment silli spi action bryce dalla howard scream cat that supposedli awesom someth first movi cheesi appear intent movi lead audienc believ one thing realli anoth reveal surpris twist arent surprisingth ensembl cast featur great perform even though henri cavil hair absolut terribl dua lipa appear short great job made miss see sam rockwel continu trend hollywood age defi forgot mid follow like tom cruis jason stathamth movi way long need better editor like flesh stori much next person calm movienow fun movi make word ridicul woefulli inadequ fun ridicul mani laugh loud moment make lot flaw dont want spoil movi keep eye blink youll miss hilarityther theme explor film motiv whether emot experienc life choic even told format spi thriller would carri got person find theori worth explor wonder id make good bad decis expo certain stimulus experi natur v nurtur anyon peopl admit would love abl speak younger selv assur thing would better eventu avoid pitfal that good enough one never know would make differ unless take away momentsi enjoy heck movi overal recommend silli alon dont take movi serious believ entir long end sequenc crazi suspens disbelief embrac
"There are some movies to which you give 6 or 5 points. But you enjoy the film and find it entertaining. This is one of those films. The movie is extremely entertaining. I had a great time at the cinema. Yes, the effects in the film are terrible; yes, it is a parody; and yes, it is ridiculous. However, it was also absurdly funny and silly. I enjoyed it very much. As a movie, I believe it is average, but not bad. Of course, there are numerous clichés in the film. Many things could have been predicted. By the way, the film is a total twist show. Twists occur one after another, just like in spy films. I lost the seriousness of the movie in the first half hour of the movie. I started enjoying it. The acting isn't perfect, but I think it's spot-on for this movie. I have never seen Bryce Dallas Howard in this kind of role before. It suits her. They also made a great duo with Sam Rockwell. The action scenes in the movie are like those in the ""Kingsman"" movies, and the director is Matthew Vaughn, who directed those movies too. I didn't fully understand the mid-credit scene of the movie, but if the second movie comes out, I will definitely go. I have no objection to this movie being a series. One of the reasons I like the movie so much is the cat. Alfie, the cat, has many roles in the movie. I don't know which scenes were real and which scenes were CGI (a few were definitely CGI), but it was very funny and entertaining.",movi give point enjoy film find entertain one film movi extrem entertain great time cinema ye effect film terribl ye parodi ye ridicul howev also absurdli funni silli enjoy much movi believ averag bad cours numer clich film mani thing could predict way film total twist show twist occur one anoth like spi film lost serious movi first half hour movi start enjoy act isnt perfect think spoton movi never seen bryce dalla howard kind role suit also made great duo sam rockwel action scene movi like kingsman movi director matthew vaughn direct movi didnt fulli understand midcredit scene movi second movi come definit go object movi seri one reason like movi much cat alfi cat mani role movi dont know scene real scene cgi definit cgi funni entertain
"Have you ever watched a movie thats so absurd and brainless that it actually works? Argylle belongs to that group - as Matthew Vaughns latest is gladly a crowd-pleasing action flick that is full of smart twists and epic action sequences. There's no doubt that it does get ridicule at times, with huge logic gaps and absurdity - but this movie embraces its silliness, dedicating its writing to plot-twists that are so well thought out that you would never guess them coming - making Argylle an action movie that stands out enough to be enjoyable.When the movie started rolling, I at first couldn't get invested in its storyline. The narrative seemed generic andd full of irrefutable plot holes. However, I remembered Matthew Vaughns genius. What he sold us in Kick Ass and Kingsman were ridiculously entertaining and thoughtful action flicks, and I had hope Argylle was going to turn in to the same - and boy, it did. The best aspect of this movie is, no doubt, its incredible and provocative plot-twists which really add this sense of unpredictability to this film and keeps you smiling always. These really start to kick off from the half-hour mark - whenever you predict whats about to happen, we get the total opposite - and there's clever hints skillfully layered around foreshadowing and setting up these twists to make you smile when they happen. It's definitely arguable from another perspective that they aren't justified enough, as they do question more potential plot holes - however this is what adds to the unpredictability and distinct nature of this movieThe ensemble cast also just adds to the fun. Everyone does a great job, but Sam Rockwell's character is the most entertaining and easiest to root for.This fun isn't without its issues, though - as its main one is its lack of any emotion or layers within our characters. They are often unconvincing and bland, with the only form of character dynamics coming from our protagonist and their partner in crime. Apart from that though, we have no reason to care for our characters, any of them in particular. The CGI is often horrific at times too. It shows its decency in some fight-scenes, but in others it is truly appalling.Ultimately, and despite the movies issues, Argylle and It's absurd plot (that I don't want to talk about as there are just too many twists!) will keep all audiences engaged, purely thanks to Vaughn and the writing teams genius plot-twists that make this movie one to definitely check out, standing out from the hoard of movies in its genre. And thats just what we need from it, especially in this day and age where politics and global issues distract us from having a good time!",ever watch movi that absurd brainless actual work argyl belong group matthew vaughn latest gladli crowdpleas action flick full smart twist epic action sequenc there doubt get ridicul time huge logic gap absurd movi embrac silli dedic write plottwist well thought would never guess come make argyl action movi stand enough enjoyablewhen movi start roll first couldnt get invest storylin narr seem gener andd full irrefut plot hole howev rememb matthew vaughn geniu sold u kick as kingsman ridicul entertain thought action flick hope argyl go turn boy best aspect movi doubt incred provoc plottwist realli add sen unpredict film keep smile alway realli start kick halfhour mark whenev predict what happen get total opposit there clever hint skill layer around foreshadow set twist make smile happen definit arguabl anoth perspect arent justifi enough question potenti plot hole howev add unpredict distinct natur movieth ensembl cast also add fun everyon great job sam rockwel charact entertain easiest root forthi fun isnt without issu though main one lack emot layer within charact often unconvinc bland form charact dynam come protagonist partner crime apart though reason care charact particular cgi often horrif time show decenc fightscen other truli appallingultim despit movi issu argyl absurd plot dont want talk mani twist keep audienc engag pure thank vaughn write team geniu plottwist make movi one definit check stand hoard movi genr that need especi day age polit global issu distract u good time
"I saw this title at an advance screening and just took my SO to check it out before any spoilers got to him. Is it perfect? No, what is? Is it fun? YES!!I don't know where we went off the rails as an audience that we get more enjoyment in dumping on everything than just sitting back and taking in something lighthearted and fun. I went in expecting some kind of Romancing the Stone / 2022's Lost City style story and was instead zig-zagged through countless twists that others have criticized as one-too-many, but I felt were just enough to keep me on the edge of my seat. Yes, it ran a tad bit long, but I can't imagine what I would relegate to the cutting room floor.It's full of twists and turns, beautiful and original fight sequences, and romance. Like Aidan says at some point in regards to Elly's writing - we don't need another Sense and Sensibility (or something to that degree). If you're looking for a fun trip, have enjoyed Vaugh's style previously, and don't have a stick up your tush/can't stand seeing a powerful woman - go see it and have fun. Haters? Take your misery somewhere else already <3.8.5/10
Anything under a 5? Get over yourselves.",saw titl advanc screen took check spoiler got perfect fun yesi dont know went rail audienc get enjoy dump everyth sit back take someth lightheart fun went expect kind romanc stone lost citi style stori instead zigzag countless twist other critic onetoomani felt enough keep edg seat ye ran tad bit long cant imagin would releg cut room floorit full twist turn beauti origin fight sequenc romanc like aidan say point regard elli write dont need anoth sen sensibl someth degre your look fun trip enjoy vaugh style previous dont stick tushcant stand see power woman go see fun hater take miseri somewher el alreadi anyth get
"LIKES:Humor
-I enjoyed a lot of the comedy in this movie, despite how cheeky and over the top it can be sometime.-Argylle uses a lot of tactics to get a laugh, including: sarcasm, straight up delivery, unbelievable stunts, cheesy moments, and some slapstick that helps go with the flow of the Vaughn movie.-Balanced into a surprising degree, it doesn't go too farfetched for viewers like me and helps blend that comic book quality with real life that meshes well for me and keeps the movie in that fun area that the first two Kingsman did well.Music
-Absolutely one of my favorite elements, Vaughn's group has helped pull the right tracks together that are used so intelligently to accomplish a lot of things.-Sometimes the song is just funny, that perfect touch to go with the theme, sell the thoughts, and add that background noise that hits scene by scene in the sequence to bring everything together
-Other times, the song is just catchy, very energetic, upbeat, and with the sound effects, that culmination of sound engineering that gets me pumped to find the right song.-It's dynamic, it's quirky, and it really just has the Vaughn feeling behind it that I've loved in most of the spy ring craziness.The Fun
-Like Kingsman movies 1 and 2, the movie for me was just fun.-It didn't get too caught up in the politics and agendas of the world, but went back to that ludicrous story that blended many elements together into an engaging piece that kept my attention.-And yet, still has a story that helps ground it and lead to a more well-rounded experience that avoids (mostly) getting caught up on an element or gimmick to bash it into paste.The Story:
-I won't say it's the best, but the movie still holds candor for elevating the film past just knock off jokes and violent punches.-Argylle's story actually gives some character development in two of the title characters, helping focus on the story elements and less on the power player role that I very much enjoyed.-A little bit of world building, alongside some engaging elements really gave me characters to follow, and upped the stakes a bit to help accomplish much in the short time period.The Action To Some Degree
-Vaughn knows how to make memorable action sequences and this movie still shows his creative elements coming to life.-The early stuff surprisingly is grounded, a bit more traditional outside of a few stunts that scream Rockwell fervor.-Near the end though, most of the bouts are totally in the comic book aspect, over the top, flashy, funny, and downright corny that I couldn't help but love everything coming together.-If that's not your element, chances are this movie wasn't for you, but for fans of the extreme Kingsman brand, stick around for the latter hour of the movie to get your wishes.The Acting
-Once again, I'll focus on the three actors with the most time and/or have the most build up, or else we'll be here all night.-Cavill is fine for the time he is on screen. He's got the sex appeal of the Pierce Brosnan spy, the delivery that works with the role, and yet the humor in the later portions of the movie. It's just too bad he isn't on screen enough to really blend it all together to the max (more on that later)
-Rockwell is Rockwell, fantastic at what he does and bringing his trade sarcasm with it. In this film, he's sarcastic, drops one-liners, just naturally humorous to me, and yet has that moment of vulnerability down that shows how talented he is.-But Howard surprised me with her props in this film, once more proving she can give more layered roles. She's nerdy, she's anxious, she's loving, and so much more, all brought together to make this odd situation believable, and often avoiding the annoying levels that this thing could have gone into.The Pace, Mostly
-And like most of the spy-action entries in this director's list, the pace is engaging for me given the balance of faster walking through the scenes, but slowing down to still smell the roses.-Argylle does its best to find the right ratio of storytelling, world building, and action, all to help further uncover the mystery of this writer's talents and the truth they are seeking.-And for much of the film, I admit they accomplished a lot and made the 2 hour and 17 minute run time feel better than I anticipated, and that is impressive in this day and age when you can complete a story in that time range.DISLIKES:The CGI Needs Work
-Some corners were cut in this film and one of them was the CGI of the film.-It is not the worst thing I've seen, but there are a lot of moments where the budget cuts and stretched graphics stood out and could be a tad annoying when not used right.-Whether this is during the action scenes, or sometime the backgrounds, Argylle's tech prowess needs some work to obtain the same prowess it did in the past and not get so blurred by the limitations of CGI.The Action Could Have Been Better
-Argylle keeps the action a little closer on the pulse of reality, forgoing the usual effects for much of the first part of the film and keeping it more of a straight shooter, brawler, with just a little twist.-Eventually we get to the roots, but for this limitation for me, the stunts just needed to be a little more spread out and hold that wow factor Vaughn's work is known to have.-Where were the over the top car stunts or off the wall blasts? Where was that pinnacle end fight that didn't feel so last minute and a stretch to fit another twist into the mix.-And though much of it does become balanced, I can't help but think there was still some more tweaking to be done to help find that balance the first Kingsman accomplished for me.A Few Too Many Twists?-I agree with the reviewers that perhaps Fuchs got a tad carried away with the number of twists in this movie.-Argylle is loaded to the nines with plots twists. Some of these are good, and others feel forced and added on at the end in some vain attempt to try and break a record.-They aren't all bad, but at some point, the amount of twists and surprises gets to the point of annoying for me and they could have cut a few things to help finessed the story and help on some of the other dislikes above.-Perhaps that straight and narrow could have gone a bit more to help achieve the same wow factor for ArgylleBalancing Of Actors Needs Improvement
--For me the biggest limitation is by far the balancing of the cast and the characters that get promoted in the commercial.-Rockwell and Howard have the most screen time, but after that, most of the rest of the cast is in these fleeting moments, with only Cavill eking out a few more moments.-True, they all have that memorable factor, but I know there was a lot more they could have done with them, more inclusion and bending the story around their involvement like the first part of the movie.-Samuel L Jackson, Cena, Dua Lipa, and more just felt like they got the shaft on this film, and though better than some movies, Argylle still shows what loading up on a cast can do if not balanced.The VERDICT:Argylle was a lot of fun for this reviewer, and was a lot better than the prequel a few years ago for the series. The primary reason is just Vaughn pulling his magic of blending so many things into an entertaining piece and finding the way to just make it energetic and fun. Some decent acting to deliver the lines, character development, escalating action and plenty of comedy all mesh well and optimize the feelings Vaughn knows how to make come alive. An engaging pace and just that entertainment value were all elements I loved and found worthy of the theater visit. Yet, it still has room to improve to get back to the first Kingsman for me. The action gradually gets to that exciting level, but feels a bit stiff to begin with as the move finds ground. The twists and pacing need a bit more sprucing up to be that perfect balance of storytelling and flair I know this director can bring. Yet, it's the CGI and the character integration that are the weakest elements, and no amount of catchy music and humor is going to offset that several key players were fairly absent. Still, I give this movie a solid go to and had fun with the theater experience, so I encourage others to get it a try at the theater if possible.My scores are:Action/Thriller: 7.5-8.0
Movie Overall: 7.0.",likeshumor enjoy lot comedi movi despit cheeki top sometimeargyl use lot tactic get laugh includ sarcasm straight deliveri unbeliev stunt cheesi moment slapstick help go flow vaughn moviebalanc surpris degre doesnt go farfetch viewer like help blend comic book qualiti real life mesh well keep movi fun area first two kingsman wellmus absolut one favorit element vaughn group help pull right track togeth use intellig accomplish lot thingssometim song funni perfect touch go theme sell thought add background nois hit scene scene sequenc bring everyth togeth time song catchi energet upbeat sound effect culmin sound engin get pump find right songit dynam quirki realli vaughn feel behind ive love spi ring crazinessth fun like kingsman movi movi funit didnt get caught polit agenda world went back ludicr stori blend mani element togeth engag piec kept attentionand yet still stori help ground lead wellround experi avoid mostli get caught element gimmick bash pasteth stori wont say best movi still hold candor elev film past knock joke violent punchesargyl stori actual give charact develop two titl charact help focu stori element le power player role much enjoyeda littl bit world build alongsid engag element realli gave charact follow up stake bit help accomplish much short time periodth action degre vaughn know make memor action sequenc movi still show creativ element come lifeth earli stuff surprisingli ground bit tradit outsid stunt scream rockwel fervornear end though bout total comic book aspect top flashi funni downright corni couldnt help love everyth come togetherif that element chanc movi wasnt fan extrem kingsman brand stick around latter hour movi get wishesth act ill focu three actor time andor build el well nightcavil fine time screen he got sex appeal pierc brosnan spi deliveri work role yet humor later portion movi bad isnt screen enough realli blend togeth max later rockwel rockwel fantast bring trade sarcasm film he sarcast drop onelin natur humor yet moment vulner show talent isbut howard surpris prop film prove give layer role she nerdi she anxiou she love much brought togeth make odd situat believ often avoid annoy level thing could gone intoth pace mostli like spyaction entri director list pace engag given balanc faster walk scene slow still smell rosesargyl best find right ratio storytel world build action help uncov mysteri writer talent truth seekingand much film admit accomplish lot made hour minut run time feel better anticip impress day age complet stori time rangedislikesth cgi need work corner cut film one cgi filmit worst thing ive seen lot moment budget cut stretch graphic stood could tad annoy use rightwheth action scene sometim background argyl tech prowess need work obtain prowess past get blur limit cgith action could better argyl keep action littl closer pul realiti forgo usual effect much first part film keep straight shooter brawler littl twisteventu get root limit stunt need littl spread hold wow factor vaughn work known havewher top car stunt wall blast pinnacl end fight didnt feel last minut stretch fit anoth twist mixand though much becom balanc cant help think still tweak done help find balanc first kingsman accomplish mea mani twistsi agre review perhap fuch got tad carri away number twist movieargyl load nine plot twist good other feel forc ad end vain attempt tri break recordthey arent bad point amount twist surpris get point annoy could cut thing help fine stori help dislik aboveperhap straight narrow could gone bit help achiev wow factor argyllebalanc actor need improv biggest limit far balanc cast charact get promot commercialrockwel howard screen time rest cast fleet moment cavil eke momentstru memor factor know lot could done inclus bend stori around involv like first part moviesamuel l jackson cena dua lipa felt like got shaft film though better movi argyl still show load cast balancedth verdictargyl lot fun review lot better prequel year ago seri primari reason vaughn pull magic blend mani thing entertain piec find way make energet fun decent act deliv line charact develop escal action plenti comedi mesh well optim feel vaughn know make come aliv engag pace entertain valu element love found worthi theater visit yet still room improv get back first kingsman action gradual get excit level feel bit stiff begin move find ground twist pace need bit spruce perfect balanc storytel flair know director bring yet cgi charact integr weakest element amount catchi music humor go offset sever key player fairli absent still give movi solid go fun theater experi encourag other get tri theater possiblemi score areactionthril movi overal
